title,image_url,video_url,instructions,teaching_points,position,starting_zone,ending_zone,situation,hockey_skills,complexity
"DEFENCE - RETRIEVAL - DRAG, SPRINT AND SHOOT",https://cdn.hockeycanada.ca/hockey-canada/Hockey-Programs/Drill-Hub/Downloads/Drills/defence_retrieval_drag_sprint_and_shoot.jpg?w=640&h=360&c=2&f=ffffff&q=60,,"Players start on blue line, pucks along boards at the hash marks.; Player skates forwards to retrieve puck – stops and drags it
    back to the blue line.; Depending on which hand the players shoots – it is either
    sprint along the blue line to the middle, or a drag to the
    middle for shot","Quick feet, head up before shooting to make sure lane is open",['Defence'],Unknown,Unknown,[],"['Skating', 'Shooting']",Intermediate
DEFENCE – RETRIEVAL WITH SHOT,https://cdn.hockeycanada.ca/hockey-canada/Hockey-Programs/Drill-Hub/Downloads/Drills/defence_retrieval_with_shot.jpg?w=640&h=360&c=2&f=ffffff&q=60,,"Players start on hash marks along boards.; D have to tag up to blue line, while puck is spotted in the corner.; D retrieve puck make an outlet pass to the next person in
    line and then open up for return pass and shot on net.","Quick feet to tag up to blue line; Retrieve puck, with fake and shoulder check; good outlet pass and then ready for quick shot on net.",['Defence'],Unknown,Unknown,['Defensive Play'],"['Skating', 'Stickhandling', 'Passing', 'Shooting']",Intermediate
DEFENCE – 1 TOUCH – READ AND REACT 1 ON 1,https://cdn.hockeycanada.ca/hockey-canada/Hockey-Programs/Drill-Hub/Downloads/Drills/defence_1_touch_read_and_react_1on1.jpg?w=640&h=360&c=2&f=ffffff&q=60,,"Players start in two lines outside blue line, fwds in one, D in
    the other.; D skates backwards and one touch passes with Fwd.; Fwd can stop and turn up ice at any time, turns at blue line
    and attacks 1 on 1; D react to get up ice and close gap",D present target; Good pass reception and return; Fwd quick feet; D get up to close gap,"['Defence', 'Forward']",Neutral Zone,Neutral Zone,['Transition'],"['Skating', 'Passing', 'Positioning']",Intermediate
DEFENCE – AGILITY RETRIEVAL TO DEFENCE SHOT,https://cdn.hockeycanada.ca/hockey-canada/Hockey-Programs/Drill-Hub/Downloads/Drills/defence_agility_retrieval_to_defence_shot.jpg?w=640&h=360&c=2&f=ffffff&q=60,,"Defenseman in the circle will make 4 passes, 2 to each point; Defenseman should pull the puck around the circle dot each
time; Players at the point will shoot as soon as they get a pass: use
different shooting options; When 4 passes are made, player in the other circle goes.
Defensemen rotate between skaters and shooters","Good agility drill for defensemen; Move feet quickly, keep chest and toes up ice; Get the puck in a passing position as quickly as possible; Shooting defensemen need to use proper skills and hit the
net. Coach can indicate the different shooting options they
would like to see",['Defence'],Unknown,Unknown,['Defensive Play'],"['Skating', 'Passing', 'Shooting']",Intermediate
DEFENCE - DELAY 1 ON 1,https://cdn.hockeycanada.ca/hockey-canada/Hockey-Programs/Drill-Hub/Downloads/Drills/defence_delay_1on1.jpg?w=640&h=360&c=2&f=ffffff&q=60,,"Forward attacks around the pylon and the defenseman steps
    up and plays the 1 on 1; Forward must” delay” and cut to the boards; Defenseman tries to keep a good gap , steps up and plays
    the 1 on 1; Play out the 1 on 1 until a clear or a play stoppage","Key teaching point for the defenseman is when you play a
    1-1 in the defensive zone, lock on that player. If the player
    delays, you step up and keep playing the 1-1; Defenseman needs to use proper transitions skating skills.
    Stick on puck and body on body; Offensive player keeps feet moving and attacks the net with
    speed",['Defence'],Defensive Zone,Defensive Zone,['Defensive Play'],"['Skating', 'Positioning', 'Transition']",Intermediate
DEFENCE – DOUBLE FIGURE 8 SKATING,https://cdn.hockeycanada.ca/hockey-canada/Hockey-Programs/Drill-Hub/Downloads/Drills/defence_double_figure_8_skating.jpg?w=640&h=360&c=2&f=ffffff&q=60,,"Players start in corner with puck; Skate through dot to top of circle, transition backwards to
    bottom of circle, ride inside edge to skate forwards to top of
    circle in figure 8 pattern; Tight turn forwards to bottom of circle, turn up ice and skate
    forward around top of circle for shot on net.; Add escape move at bottom of circle for progression; Switch corners","Smooth transitions, ride inside edge when transitioning
    forward; Keep puck loaded on forehand when coming out of transition",[],Unknown,Unknown,[],['Skating'],Intermediate
DEFENCE – DOUBLE NZ QUICK UP #1,https://cdn.hockeycanada.ca/hockey-canada/Hockey-Programs/Drill-Hub/Downloads/Drills/defence_double_nz_quick_up.jpg?w=640&h=360&c=2&f=ffffff&q=60,,"Both ends at same time. D skates to the NZ dot, pivots
    backwards, and receives puck from coach.; D passes to F1 on the wall, F1 down & shoot. D re-gaps
    & picks up 2nd puck from the coach & passes to F2 in the
    middle lane with good timing. F2 down & shoot...2nd shot.
    D up ice to blueline, receives from F1, takes 3rd shot.",Forward supports D with good passing angle; D keep toes up ice as much as possible,['Defence'],Unknown,Unknown,['Transition'],"['Skating', 'Passing', 'Shooting', 'Timing']",Intermediate
DEFENCE – DOUBLE SHOT – BACK DOOR,https://cdn.hockeycanada.ca/hockey-canada/Hockey-Programs/Drill-Hub/Downloads/Drills/defence_double_shot_back_door.jpg?w=640&h=360&c=2&f=ffffff&q=60,,"Forwards in corner with pucks, defence on each side of the
    ice on the blue line with pucks.; D gets to middle for shot, opposite D does the same, forward
    skates around top of circle for 3rd shot on net; Fwd then picks up another puck from original corner and
    skates behind net with puck. Strong side D jumps down as
    an option for a pass, weak side D slides over to take strong
    side D spot.; Fwd has option to pass to either D based on what
    is available.",Head up on shots; Fwd head up on pass; D don’t telegraph where pass is coming from,"['Forward', 'Defence']",Unknown,Unknown,['Offensive Play'],"['Shooting', 'Passing', 'Positioning']",Intermediate
DEFENCE – DOWN THE WALL CYCLE – REGROUP 2 ON 0,https://cdn.hockeycanada.ca/hockey-canada/Hockey-Programs/Drill-Hub/Downloads/Drills/defence_down_the_wall_cycle_regroup_2on0.jpg?w=640&h=360&c=2&f=ffffff&q=60,,"Pucks on outside hashmarks in zone, forwards on wall,
    defence along boards at blue line; First forward grabs puck and skates around top of circle for
    shot on net; Continue to other side to get pass from opposite side
    forward who starts cycle; First forward picks up puck, skates toward blue line and
    performs high cycle with D who jumps down to receive puck.; Forwards then go to net and high slot to receive pass from D; After shot, D jumps out of zone to get pass from coach, and
    passes to regrouping forwards for shot on net.; D jumps inside blue line to get pass for point shot",Proper spacing on cycle; Forward don’t jump too soon; Quick regroup and attack,['Defence'],Unknown,Unknown,['Offensive Play'],"['Skating', 'Passing', 'Shooting', 'Positioning']",Intermediate
DEFENCE – EVADING THE FORECHECK,https://cdn.hockeycanada.ca/hockey-canada/Hockey-Programs/Drill-Hub/Downloads/Drills/defence_evading_the_forecheck.jpg?w=640&h=360&c=2&f=ffffff&q=60,,"Defence behind net with puck. Forwards in middle of ice
    near inside hashmarks; On coaches’ signal, forward forechecks, defence has to skate
    puck out past tops of circles; If forward turns puck over, then try to score; Progression – add second forechecker","Defence must make read and take easiest path out from
    behind net (skate way out of trouble); Defence good fakes to create path; Forward force D out on backhand",['Defence'],Defensive Zone,Neutral Zone,['Forecheck'],"['Skating', 'Stickhandling']",Intermediate
DEFENCE - GOALIE SET PUCK - 1 ON 1,https://cdn.hockeycanada.ca/hockey-canada/Hockey-Programs/Drill-Hub/Downloads/Drills/defence_goalie_set_puck_1on1.jpg?w=640&h=360&c=2&f=ffffff&q=60,,"Forwards rim pucks; Goaltender stops puck and listens for defenseman’s communication; Defenseman can either yell “set” or “pass”. In this drill,
    goalies set the puck; Defenseman retrieves, makes an outlet pass then steps up to
    play the 1on 1","The key is communication between defensemen and goaltender; They need to decide what is going to be done with the puck
    before the defenseman arrives; “Set” or “Pass” should be options every time the goaltender
    touches the puck; If it is “set”, goaltender will set the puck for the defensemen
    to pick up. If “pass”, then defensemen will get open and
    goaltender will pass the puck to them or a forward","['Defence', 'Goalie']",Unknown,Unknown,"['Defensive Play', 'Communication']",['Communication'],Intermediate
DEFENCE – GOALIE SET PUCK - RETRIEVAL - 1 ON 1,https://cdn.hockeycanada.ca/hockey-canada/Hockey-Programs/Drill-Hub/Downloads/Drills/defence_goalie_set_puck_retrieval_1on1.jpg?w=640&h=360&c=2&f=ffffff&q=60,,"Defensemen tag up on the blue line and coach dumps the
    puck. Defenseman yells “set” and goaltender sets the
    puck. Goaltender stops puck and listens for defenseman’s
    communication; Defenseman can either yell “set” or “pass”. In this drill,
    goalies set the puck; One player picks up the puck and makes an outlet pass to the
    other player then steps up to play the 1 on 1; Use good 1 on 1 tactics","The key is communication between defensemen and
    goaltender; They need to decide what is going to be done with the puck
    before the defenseman arrives; “Set” or “Pass” should be options every time the goaltender
    touches the puck; If it is “set” goaltender will set the puck for the defensemen
    to pick up. If “pass” then defensemen will get open and
    goaltender will pass the puck to them or a forward; Use good 1 on 1 tactics","['Defence', 'Goalie']",Unknown,Unknown,['Defensive Play'],['Communication'],Intermediate
DEFENCE - MIRROR GAP CONTROL,https://cdn.hockeycanada.ca/hockey-canada/Hockey-Programs/Drill-Hub/Downloads/Drills/defence_mirror_gap_control.jpg?w=640&h=360&c=2&f=ffffff&q=60,,"Key concept is for the defensive player to get and keep a
    tight gap on the offensive player; Offensive player skates the circles and defensive player tries
    to stay a stick length away; The drill then turns into a 1-1 drill back at the net","Defending player keeps a tight gap on the offensive player; Defensive player keep shoulders square and tries to limit
    crossovers; Defensive player tries to stay within one stick length; Use proper form on transitions both backward to forward
    and forward to backward; On the 1-1, defensive player takes inside ice and keeps the
    attack outside; Stick on puck, body on body",['Defence'],Unknown,Unknown,['Defensive Play'],"['Skating', 'Positioning', 'Angling', 'Gapping']",Intermediate
DEFENCE – OFFENCE – POINT SHOT – DELAY DRIVE,https://cdn.hockeycanada.ca/hockey-canada/Hockey-Programs/Drill-Hub/Downloads/Drills/defence_offense_point_shot_delay_drive.jpg?w=640&h=360&c=2&f=ffffff&q=60,,"Defence start on blue line with pucks, fwds in corner
    with pucks.; Defence get to middle of ice for shot on net. Once defence
    shoots, Fwd skates up wall, delays and takes puck to net for
    shot.; Defence then skates to boards to pick up a second puck, gets
    back to middle for second shot on net with Fwd in front to tip
    or find rebound.","Defence, get to middle quickly, head up when shooting; Fwds, keep feet moving out of the delay, take puck hard to
    the net.; Defence quickly to boards and back to middle for second
    shot","['Defence', 'Forward']",Unknown,Unknown,['Offensive Play'],"['Shooting', 'Skating']",Intermediate
DEFENCE – QUICK UP – MIDDLE - 1 ON 1,https://cdn.hockeycanada.ca/hockey-canada/Hockey-Programs/Drill-Hub/Downloads/Drills/defence_quick_up_middle_1on1.jpg?w=640&h=360&c=2&f=ffffff&q=60,,"Players start in two lines outside blue line, fwds in one, D in
    the other.; Fwd dumps puck into end zone; D retrieves puck – shoulder check, quick fake, skate to corner
    for quick up to Fwd in middle of ice; Follow pass up ice, Fwd receives pass, skates up ice, turns at
    blue line and attacks 1 on 1","D get to puck quickly, shoulder check, fake before getting
    puck; Quick hard pass up ice; Fwd communicate; D get up to close gap","['Defence', 'Forward']",Defensive Zone,Offensive Zone,['Transition'],"['Skating', 'Passing', 'Communication']",Intermediate
DEFENCE - QUICK UP NZ TRANSITION,https://cdn.hockeycanada.ca/hockey-canada/Hockey-Programs/Drill-Hub/Downloads/Drills/defence_quick_up_nz_transition.jpg?w=640&h=360&c=2&f=ffffff&q=60,,"Defensemen will utilize the “quick up” option for neutral
    zone transition. This drill is excellent for a defenseman split
    session in practice; Three players are involved independently of each other on
    both sides of the rink; Two players act as defensemen and one simulates an
    outlet player; Players pass to the outlet, step up ice and wait for a
    return pass; Simulates the quick up option","Move the puck up ice as a first option; Apply all transition basics: no dust, toes up ice, keep the
    puck in a passing position, headman the puck whenever
    possible; Skating is key. Make sure the defensemen transition properly
    both forward to backward and backward to forward; Pass the puck hard and then chase the puck up ice simulating
    a game situation",['Defence'],Neutral Zone,Neutral Zone,['Transition'],"['Skating', 'Passing']",Intermediate
DEFENCE – QUICK UP - WALL – 1 ON 1,https://cdn.hockeycanada.ca/hockey-canada/Hockey-Programs/Drill-Hub/Downloads/Drills/defence_quick_up_wall_1on1.jpg?w=640&h=360&c=2&f=ffffff&q=60,,"Players start in two lines outside blue line, fwds in one, D in
    the other.; Fwd dumps puck into end zone; D retrieves puck – shoulder check, quick fake, turn up ice for
    quick up to Fwd on wall; Follow pass up ice, Fwd receives pass, skates up ice, turns at
    blue line and attacks 1 on 1","D get to puck quickly, shoulder check, fake before
    getting puck; Quick hard pass up ice; Fwd communicate; D get up to close gap","['Defence', 'Forward']",Defensive Zone,Offensive Zone,['Transition'],"['Skating', 'Passing', 'Communication']",Intermediate
DEFENCE – SKATING – 4 DIRECTION PIVOT DRILL,https://cdn.hockeycanada.ca/hockey-canada/Hockey-Programs/Drill-Hub/Downloads/Drills/defence_skating_4_direction_pivot_drill.jpg?w=640&h=360&c=2&f=ffffff&q=60,,"Defence starts on dot in end zone; Skate forward to boards at blue line, transition and skate
    backwards to dot; Pivot and skate forward to corner, transition and skate
    backwards to dot; Skate forward to blue line in middle of ice, transition
    backwards to dot; Pivot, skate forward the near side goal post","Quick feet, efficient transitions; Open hips to pivot at dot",['Defence'],Defensive Zone,Defensive Zone,[],['Skating'],Intermediate
DEFENCE – TRANSITION PROGRESSION,https://cdn.hockeycanada.ca/hockey-canada/Hockey-Programs/Drill-Hub/Downloads/Drills/defence_transition_progression.jpg?w=640&h=360&c=2&f=ffffff&q=60,,"Place two pylons about 25 feet apart anywhere on the ice; 1st progression – Players skate to top pylon – pivot heels
    first, then escape move coming out of pivot – repeat going
    opposite way next time; 2nd progression – toes first; 3rd progression – ride inside edge; Repeat with pucks; Add passes","Good feet, focus on skill, not speed to start; Unweight, only one crossover coming out of pivot; Ensure skating movements are done correctly before
    progressing to pucks and then passes",['Defence'],Unknown,Unknown,['Transition'],"['Skating', 'Pivoting', 'Escape Moves', 'Passing']",Intermediate
DEFENCE – TRANSITION – QUICK FEET,https://cdn.hockeycanada.ca/hockey-canada/Hockey-Programs/Drill-Hub/Downloads/Drills/defence_transition_quick_feet.jpg?w=640&h=360&c=2&f=ffffff&q=60,,"Place 3 pylons in triangle on both sides of ice; Defence skate up to first pylon, transition, backwards to
    second, then forward to third; Pivot and skate around bottom of circle around the top of
    the pylons for shot on net; Opposite sides alternate continuously",Good transition; Quick feet,['Defence'],Unknown,Unknown,['Transition'],['Skating'],Intermediate
DEFENCE - TRIPLE SHOT,https://cdn.hockeycanada.ca/hockey-canada/Hockey-Programs/Drill-Hub/Downloads/Drills/defence_triple_shot.jpg?w=640&h=360&c=2&f=ffffff&q=60,,"Drill starts with coach passing to defenseman who takes
    puck towards middle of ice and shoots; Wall defenseman passes to same player and he “one times”
    or controls and shoots; Player then “jumps down” and coaches passes and defenseman
    shoots “backdoor”; Defenseman then initiates next rotation with a pass to the
    blue line; Switch sides","Defenseman has 3 shooting skills, to middle and shoot,
    receive pass and shoot and jump down to be a threat; When jumping down, make eye contact, have your stick on
    the ice and call for the pass. Practice a quick release on net.
    Try to present your forehand.",['Defence'],Unknown,Unknown,['Offensive Play'],"['Shooting', 'Passing', 'Communication']",Intermediate
DEFENCE – TURNBACK - MIDDLE – 1 ON 1,https://cdn.hockeycanada.ca/hockey-canada/Hockey-Programs/Drill-Hub/Downloads/Drills/defence_turnback_middle_1on1.jpg?w=640&h=360&c=2&f=ffffff&q=60,,"Players start in two lines outside blue line, fwds in one D in
    the other.; Fwd dumps puck into end zone; D retrieves puck – shoulder check, quick fake, wheel behind
    net, stop, turn back to original side and make pass to supporting
    forward; Follow pass up ice, Fwd receives pass, skates up ice, turns at
    blue line and attacks 1 on 1","D get to puck quickly, shoulder check, fake before
    getting puck; Quick hard pass up ice; Fwd communicate; D get up to close gap","['Defence', 'Forward']",Unknown,Unknown,['Transition'],"['Skating', 'Passing', 'Positioning', 'Communication']",Intermediate
DEFENCE – WHEEL – MIDDLE – 1 ON 1,https://cdn.hockeycanada.ca/hockey-canada/Hockey-Programs/Drill-Hub/Downloads/Drills/defence_wheel_middle_1on1.jpg?w=640&h=360&c=2&f=ffffff&q=60,,"Players start in two lines outside blue line, fwds in one D in
    the other.; Fwd dumps puck into end zone; D retrieves puck – shoulder check, quick fake, wheel behind
    net hit supporting Fwd with pass in middle of ice.; Follow pass up ice, Fwd receives pass, skates up ice, turns at
    blue line and attacks 1 on 1","D get to puck quickly, shoulder check, fake before getting
    puck; Quick hard pass up ice; Fwd communicate; D get up to close gap","['Defence', 'Forward']",Neutral Zone,Neutral Zone,['Transition'],"['Skating', 'Passing', 'Positioning', 'Communication']",Intermediate
DEFENCE – OFFENCE - 1 ON 1,https://cdn.hockeycanada.ca/hockey-canada/Hockey-Programs/Drill-Hub/Downloads/Drills/offence_defence_1on1.jpg?w=640&h=360&c=2&f=ffffff&q=60,,"Defence start on boards at blueline, forwards near neutral
    zone face off dot; Defence takes 2 or 3 strides and shoots puck on net,
    immediately pivots and turns to face up ice; Forward passes puck to D, then opens up and receives
    breakout pass from D; Forward skates outside blueline then turns and attacks D
    1 on 1","Defence good hard shot on net; Quick pivot stick on ice, to receive pass; Forward, good first pass, present target to receive; Get puck to net","['Defence', 'Forward']",Neutral Zone,Neutral Zone,"['Breakout', 'Zone Entry']","['Shooting', 'Passing', 'Skating']",Intermediate
DEFENCE – OFFENCE – ALTERNATING CORNER 1 ON 1,https://cdn.hockeycanada.ca/hockey-canada/Hockey-Programs/Drill-Hub/Downloads/Drills/offence_defence_alternating_corner_1on1.jpg?w=640&h=360&c=2&f=ffffff&q=60,,"Players line up in circle for 1 on 1. Defence dumps puck in
    corner, forward has to pick it up, protect puck while driving
    to the net.; Defence tries to prevent net drive or shot; Alternate sides","Offence - good puck protection, creativity; Defence – body on body, stick on puck; Compete","['Forward', 'Defence']",Unknown,Unknown,"['Offensive Play', 'Defensive Play']","['Skating', 'Stickhandling', 'Positioning']",Intermediate
DEFENCE – OFFENCE – AREA PASS – 1 ON 1,https://cdn.hockeycanada.ca/hockey-canada/Hockey-Programs/Drill-Hub/Downloads/Drills/offence_defence_area_pass_1on1.jpg?w=640&h=360&c=2&f=ffffff&q=60,,"Defence start on boards at hashmarks, forwards on boards at
    centre red line; Defence gap up to blue line, and pivot backwards, forward
    hit defence with pass.; Defence steps to inside and makes an area pass for forward
    to skate into; Forward then picks up puck and regroups in neutral zone to
    attack defence 1 on 1",Forward wait until defence pivots before making pass; Defence place puck where forward can get it in full stride,"['Defence', 'Forward']",Unknown,Unknown,['Transition'],"['Passing', 'Positioning']",Intermediate
DEFENCE – OFFENCE – BREAKOUT – REGROUP 2 ON 2,https://cdn.hockeycanada.ca/hockey-canada/Hockey-Programs/Drill-Hub/Downloads/Drills/offence_defence_breakout_2on2.jpg?w=640&h=360&c=2&f=ffffff&q=60,,"Defence on blue line on each side of ice. Forwards in
    same position; Defence starts with shot on net, turns around to receive pass
    from forward on same side of ice.; Opposite side D skates down below goal line to receive D to D
    pass, forwards get in position for breakout pass; Forwards regroup in neutral zone, then attack 2 on 2","Good support by D, forward be a good option","['Defence', 'Forward']",Defensive Zone,Offensive Zone,['Breakout'],"['Passing', 'Positioning']",Intermediate
OFFENCE - DEFENCE – CORNER 1 ON 1,https://cdn.hockeycanada.ca/hockey-canada/Hockey-Programs/Drill-Hub/Downloads/Drills/offence_defence_corner_1on1.jpg?w=640&h=360&c=2&f=ffffff&q=60,,"Players line up in circle for 1 on 1. Defence dumps puck in
    corner, forward has to pick it up, protect puck while driving
    to the net.; Defence tries to prevent net drive or shot; Progression – let the forward change direction instead of
    just net drive","Offence - Good puck protection; Defence – body on body, stick on puck","['Forward', 'Defence']",Unknown,Unknown,"['Offensive Play', 'Defensive Play']","['Stickhandling', 'Positioning']",Intermediate
"DEFENCE – OFFENCE – PUCK SUPPORT 1 ON 1, 2 ON 2",https://cdn.hockeycanada.ca/hockey-canada/Hockey-Programs/Drill-Hub/Downloads/Drills/offence_defence_puck_support_1on1_2on1.jpg?w=640&h=360&c=2&f=ffffff&q=60,,"Defence start in corner with puck, forwards on dot outside
    blue line; D skates forwards with puck then pivots and skates
    backwards, forward skates toward defence, then open pivots
    toward boards giving D a flat passing option. D passes to
    forward who skates into neutral zone, then regroups and
    attacks 1 on 1; Progression – add second forward to make it a 2 on 1. 1
    forward towards boards, second forward to middle",Flat pass to Fwd; D gap up,"['Defence', 'Forward']",Defensive Zone,Offensive Zone,['Transition'],"['Skating', 'Passing', 'Positioning']",Intermediate
GOALTENDING - BASIC STANCE (BEGINNER),https://cdn.hockeycanada.ca/hockey-canada/Hockey-Programs/Drill-Hub/Downloads/Drills/goaltending_basic_stance_beginner.jpg?w=640&h=360&c=2&f=ffffff&q=60,,,,['Goalie'],Unknown,Unknown,[],['Positioning'],Easy
GOALTENDING - BLOCKER SAVES (BEGINNER),https://cdn.hockeycanada.ca/hockey-canada/Hockey-Programs/Drill-Hub/Downloads/Drills/goaltending_blocker_saves_beginner.jpg?w=640&h=360&c=2&f=ffffff&q=60,,"Goaltender maintains solid visual connection to the puck,
    witnesses the stick impacting the puck and flight; Face plate of the Blocker is facing the puck; The Blocker is positioned so that the goaltender can focus on
    the puck but see the glove in his/her secondary (peripheral
    vision); Goaltender tracks the puck form the release right to the
    middle of the blocker face plate.; Puck impacts the blocker which is positioned in front of the
    body and angled /directed into the corner.; Goaltender pushes into pucks by brining shoulders laterally
    to pucks.; Goaltenders can execute a small shuffle while pushing into
    pucks. This will reduce the distance away from the body and
    limit having to reach or stretch for saves.; IMPORTANT NOTE: Goaltenders should avoid rotating the
    shoulders and having the catching of the puck behind the
    body.","Player positioned in the mid slot at the top of the circles; Goaltender positioned with heals at the edge of the crease
    and gloves in position as described above.; Shots are executed at a moderate speed to the blocker side; Pucks should impact the center of the blocker, controlled
    and redirected to the corner or out of play.",['Goalie'],Unknown,Unknown,[],['Positioning'],Easy
