title,image_url,video_url,instructions,teaching_points,position,starting_zone,ending_zone,situation,hockey_skills,complexity
SKATING - TRANSITION RACES,https://cdn.hockeycanada.ca/hockey-canada/Hockey-Programs/Drill-Hub/Downloads/Drills/skating_transition_races.jpg?w=640&h=360&c=2&f=ffffff&q=60,,"Start with 2 lines each with two pylons in a vertical line.; Players start at bottom pylon, on coach’s signal the player’s race to top pylon, pivot and skate backwards to bottom pylon.; Repeat by pivoting the opposite way the next time.","Efficient turns, blow as little snow as possible; Quick feet",[],Unknown,Unknown,['Transition'],['Skating'],Intermediate
SKATING - TRANSITION SKATING,https://cdn.hockeycanada.ca/hockey-canada/Hockey-Programs/Drill-Hub/Downloads/Drills/skating_transition_skating.jpg?w=640&h=360&c=2&f=ffffff&q=60,,Place 4 pylons around a circle or anywhere on the ice; Players start at bottom of circle and skate forward to top pylon - pivot  backwards to lower pylon – pivot forward to top pylon on other side; pivot backwards to lower pylon – pivot forwards to top of circle stop and skate forwards back to starting position.; Add a puck for a progression,Quick feet; Maintain speed coming out of the pivot,[],Unknown,Unknown,[],['Skating'],Intermediate
SKATING - HEEL TO HEEL,https://cdn.hockeycanada.ca/hockey-canada/Hockey-Programs/Drill-Hub/Downloads/Drills/skating_heel_to_heel.jpg?w=640&h=360&c=2&f=ffffff&q=60,,"Place two sticks on the ice, player skates with heels facing each other in circular pattern around sticks - go both ways; Add second player to act as chaser – turn into a race, or tag; Quick feet, change directions","Take your stick with you, lean forward and open knees; Find balance point, turn hips, and unweight to change feet",[],Unknown,Unknown,[],['Skating'],Easy
SKATING - DEFENCE TRANSITION SKATING,https://cdn.hockeycanada.ca/hockey-canada/Hockey-Programs/Drill-Hub/Downloads/Drills/skating_defence_transition_skating.jpg?w=640&h=360&c=2&f=ffffff&q=60,,"Players start in corner and skate towards blue line.; Turn toes and then transition backward, stop and then go forward again; Turn toes, and then unweight to get heels around – minimize crossovers prior to stopping and then skating forward.",Turn both ways; Toes first and heels first; Accelerate out of slide stop,['Defence'],Unknown,Unknown,['Transition'],['Skating'],Intermediate
SKATING - KNEE DROPS,https://cdn.hockeycanada.ca/hockey-canada/Hockey-Programs/Drill-Hub/Downloads/Drills/skating_knee_drops.jpg?w=640&h=360&c=2&f=ffffff&q=60,,"Player starts in circle down on one knee down; Alternate raising each leg, while other knee touches ice while stickhandling; Gain momentum and rhythm – drive knee up and forward when raising it. Try not touch knee to ice when lowering.; Eyes up, quick hands when stickhandling","Balance, and rhythm needed for control; Change speeds – quick, slow, quick",[],Unknown,Unknown,[],"['Skating', 'Stickhandling']",Intermediate
SKATING - ALTERNATING FEET EDGE CONTROL 02,https://cdn.hockeycanada.ca/hockey-canada/Hockey-Programs/Drill-Hub/Downloads/Drills/skating_alternating_feet_edge_control_02.jpg?w=640&h=360&c=2&f=ffffff&q=60,,"Players start on any line on the ice. Skate forward, glide on one skate.; Pivot to backwards on the same skate, then open hips and step forward with opposite skate to glide forward again.; Repeat alternating each leg.","Stay in control, stick out in front and on ice; Bend knees and unweight to pivot front to back on same skate",[],All Zones,All Zones,[],['Skating'],Intermediate
SKATING - FIGURE 8 EDGE CONTROL,https://cdn.hockeycanada.ca/hockey-canada/Hockey-Programs/Drill-Hub/Downloads/Drills/skating_figure_8_edge_control.jpg?w=640&h=360&c=2&f=ffffff&q=60,,"Place two pucks about 10 feet apart.; Player skates in a figure 8 pattern around the pucks.; Skate to the pylon on the outside edge of the inside foot, and spin on the same foot away from the pylon so the exit of the turn is on the inside edge",Perform at a speed you are comfortable with; Stick out in front; Knees bent; Cary momentum into and out of turn,[],Unknown,Unknown,[],['Skating'],Easy
SKATING - TRANSITION FIGURE 8,https://cdn.hockeycanada.ca/hockey-canada/Hockey-Programs/Drill-Hub/Downloads/Drills/skating_transition_figure_8.jpg?w=640&h=360&c=2&f=ffffff&q=60,,Place two pucks 10 feet apart; Skate in a Figure 8 pattern toes up ice; Puck must go around pylons,Keep square and balanced; Head up and control the puck,[],Unknown,Unknown,['Transition'],['Skating'],Intermediate
SKATING - HALF CIRCLE LATERAL SKATING,https://cdn.hockeycanada.ca/hockey-canada/Hockey-Programs/Drill-Hub/Downloads/Drills/skating_half_circle_lateral_skating.jpg?w=640&h=360&c=2&f=ffffff&q=60,,"One defenseman will skate half circle with feet outside skating laterally. The other defenseman will skate facing him across the middle of the circle; First, skate and focus on lateral speed. Then go other way; Progression: player skating backwards laterally will skate with the puck and hand it off to other defenseman; Progression: players will skate the same pattern and will pass the puck the whole time, can use onetime passing","Good transition skating techniques; Head up, get the puck loaded, keep shoulders square; Quick feet, good balance",['Defence'],Unknown,Unknown,[],"['Skating', 'Passing']",Intermediate
SKATING – TOE ON PUCK,https://cdn.hockeycanada.ca/hockey-canada/Hockey-Programs/Drill-Hub/Downloads/Drills/skating_toe_on_puck.jpg?w=640&h=360&c=2&f=ffffff&q=60,,"Start on blue line and place the toe of one skate on the puck,
    and use c-cuts with the other skate to propel across the ice.","Weight has to be on drive leg, too much weight on puck will
    cause skater to lose balance.; Change direction and use other leg on way back",[],Neutral Zone,Neutral Zone,[],['Skating'],Intermediate
SKATING – 2 FOOT STOP,https://cdn.hockeycanada.ca/hockey-canada/Hockey-Programs/Drill-Hub/Downloads/Drills/skating_2_foot_stop.jpg?w=640&h=360&c=2&f=ffffff&q=60,,"Players start in corner. Skate forward to first pylon and
    perform a 2 foot stop. Skate forward to second pylon and
    perform a 2 foot stop in the other direction. Repeat at all
    pylons.","Ensure equal weight distributed on both feet; Unweight, extend legs and then flex knees as feet are turning
    to perform the stop",[],Unknown,Unknown,[],['Skating'],Easy
SKATING – TIGHT TURNS,https://cdn.hockeycanada.ca/hockey-canada/Hockey-Programs/Drill-Hub/Downloads/Drills/skating_tight_turns.jpg?w=640&h=360&c=2&f=ffffff&q=60,,"Place pylons as shown in the drill diagram ( can be done
    anywhere on the ice ); Players start by skating to far pylon, tight turn around far
    pylon, weave back through, tight turn at near pylon weave
    back through to far pylon for one more tight turn.","Head, shoulders, hips, skates around pylon; Try to keep weight off of heels of skates to prevent
    slowing down",[],All Zones,All Zones,[],['Skating'],Intermediate
SKATING – TRANSITION - HEELS FIRST,https://cdn.hockeycanada.ca/hockey-canada/Hockey-Programs/Drill-Hub/Downloads/Drills/skating_transition_heels_first.jpg?w=640&h=360&c=2&f=ffffff&q=60,,"Players focus on heels first transition from forward to backward; This is used when containing the rush; Always pivot to the middle of the ice; Players are allowed one crossover after pivot then get into
    backward stride; On transition from backward to forward players “ride” and
    do not cross feet; On backward to forward pivot, lift the foot in the direction
    you are going and “load” the other foot","Players need to have a good knee bend for balance; Keep chest and toes up ice; Limit the crossing of the feet as much as possible; Players to keep their head up, shoulders back and toes up ice; Heels and hips first to turn",[],Unknown,Unknown,['Transition'],['Skating'],Intermediate
SKATING – TRANSITION - RIDE INSIDE EDGE,https://cdn.hockeycanada.ca/hockey-canada/Hockey-Programs/Drill-Hub/Downloads/Drills/skating_transition_ride_inside_edge.jpg?w=640&h=360&c=2&f=ffffff&q=60,,"Players focus on transition which allows an aggressive gap
    but also the possibility of containing; Players going left will ride the inside right foot edge and
    have the left foot ready to either continue a “toes first”
    approach or hop and shift to a backward skating contain
    approach. Players going right will ride the inside left foot
    edge and have the right foot ready; This approach allows defensemen to read and then react to
    the attacking player; On transition from backward to forward, players will do a
    single “cross under” step and go forward","Players need to have a good knee bend for balance; Keep chest and toes up ice; Limit the crossing of the feet as much as possible; Players to keep their head up, shoulders back and toes up ice; Toes may actually “turn in” as you begin the pivot",[],Unknown,Unknown,['Transition'],['Skating'],Intermediate
SKATING – TRANSITION - TOES FIRST,https://cdn.hockeycanada.ca/hockey-canada/Hockey-Programs/Drill-Hub/Downloads/Drills/skating_transition_toes_first.jpg?w=640&h=360&c=2&f=ffffff&q=60,,"Players focus on toes first transition from forwards to
    backwards; This is most often used when aggressively closing the gap; Players point toes, “unload” and then start backward stride; Players are allowed one (or none) crossover after pivot then
    get into backward stride; On transition from backward to forward, players “ride” and
    do not cross feet; On backward to forward pivot, lift the foot in the direction
    you are going and “load” the other foot","Players need to have a good knee bend for balance; Keep chest and toes up ice; Limit the crossing of the feet as much as possible; Players to keep their head up, shoulders back and toes up ice; In shifting from forward to backward, “unload” your weight
    before skating backwards",[],Unknown,Unknown,['Transition'],['Skating'],Intermediate
PUCK CONTROL - WARM-UP 02 - RANDOM OBSTACLES,https://cdn.hockeycanada.ca/hockey-canada/Hockey-Programs/Drill-Hub/Downloads/Drills/puck_control_warm_up_02_random_obstacles.jpg?w=640&h=360&c=2&f=ffffff&q=60,,"Players line up in two lines on the hashmarks; Place lots of pucks randomly down the centre of the ice; Both lines can go at the same time, or each line can alternate, skating down the middle to the far end and back along the boards.; Perform each skill as shown.",Technique is important in this warm-up to give the players lots of repetition on technical aspects of puck control.; Encourage creativity and quick hands,[],Neutral Zone,Neutral Zone,[],"['Skating', 'Stickhandling']",Easy
PUCK CONTROL - WARM-UP 03 - PUCK DOTS,https://cdn.hockeycanada.ca/hockey-canada/Hockey-Programs/Drill-Hub/Downloads/Drills/puck_control_warm_up_03_puck_dots.jpg?w=640&h=360&c=2&f=ffffff&q=60,,"Players line up in two lines on the hashmarks; Place pucks or pylons in a straight line down the ice (1 or 2 rows); Both lines can go at the same time, or each line can alternate, skating down the middle to the far end and back along the boards.; Perform each skill as shown.",Technique is important in this warm-up set up – using lots of pucks enable the players to practice the same move multiple times.,[],Neutral Zone,Neutral Zone,[],"['Skating', 'Stickhandling']",Easy
PUCK CONTROL - WARM-UP 04 - OBSTACLES,https://cdn.hockeycanada.ca/hockey-canada/Hockey-Programs/Drill-Hub/Downloads/Drills/puck_control_warm_up_04_obstacles.jpg?w=640&h=360&c=2&f=ffffff&q=60,,Players in one end in two lines at the hash marks; Place obstacle down the middle of the ice; Alternate lines performing the skills as shown avoiding the obstacles with a variety of moves,Use this as a progression from the previous warm-ups to add variety and increased difficulty,[],Offensive Zone,Offensive Zone,[],['Stickhandling'],Intermediate
PUCK CONTROL - HALF ICE WARM-UP,https://cdn.hockeycanada.ca/hockey-canada/Hockey-Programs/Drill-Hub/Downloads/Drills/puck_control_half_ice_warm_up.jpg?w=640&h=360&c=2&f=ffffff&q=60,,Players in each corner.; Place pylons in a row on each side of the ice from the red line back to the dot on the circles.; Players skate out of the corner into the neutral zone and around the pylon on the opposite side of the ice and put moves on each pylon finishing with a shot.,Quick feet out of corner; Different move on each pylon; Can add a chaser,[],Unknown,Unknown,[],"['Skating', 'Stickhandling', 'Shooting']",Intermediate
PUCK CONTROL - PYLON WARM-UP,https://cdn.hockeycanada.ca/hockey-canada/Hockey-Programs/Drill-Hub/Downloads/Drills/puck_control_pylon_warm_up.jpg?w=640&h=360&c=2&f=ffffff&q=60,,"Place pylons down middle of ice, players start on hash marks; Perform various moves down ice.; Heel to heel; Open up to backhand – puck protect; Eberle – up and back; Quick Hands toe up; Fast hand slow feet; Backhand toe drags; Stop and go quick Hands; Can be done full ice or half ice","Head up,; Repeat for consistency",[],All Zones,All Zones,[],"['Skating', 'Stickhandling']",Intermediate
PUCK CONTROL - 3 PUCK STICKHANDLE,https://cdn.hockeycanada.ca/hockey-canada/Hockey-Programs/Drill-Hub/Downloads/Drills/puck_control_3_puck_stickhandle.jpg?w=640&h=360&c=2&f=ffffff&q=60,,Place 3 pucks in a triangle formation anywhere on the ice.; Player must try to keep feet steady while utilizing only the arms and upper body to move the puck randomly through the 3 stationary pucks.; Progression is to move the pucks wider apart and then skate through the pucks while stickhandling,Work on quick hands and range of motion,[],Unknown,Unknown,[],['Stickhandling'],Intermediate
PUCK CONTROL - 4 PYLON AGILITY,https://cdn.hockeycanada.ca/hockey-canada/Hockey-Programs/Drill-Hub/Downloads/Drills/puck_control_4_pylon_agility.jpg?w=640&h=360&c=2&f=ffffff&q=60,,"Place 4 pylons around a circle or anywhere on the ice.; Players start by carrying a puck and stickhandling around the pylons in a random fashion.; Progression – add a second player and have them challenge each other instead of avoiding each other; Progression – two players, one puck and they have to support each other by passing the puck back and forth while facing each other.; Progression – have one player stationary on wall and pass back and forth, to work on puck support. Skate and pass, or one touch","Keep feet moving, be creative, and go as fast as possible – quick feet and quick hands; Always be ready to pass and receive – Expect the Pass",[],Unknown,Unknown,[],"['Skating', 'Stickhandling', 'Passing']",Intermediate
PUCK CONTROL - AGILITY NETS,https://cdn.hockeycanada.ca/hockey-canada/Hockey-Programs/Drill-Hub/Downloads/Drills/puck_control_agility_nets.jpg?w=640&h=360&c=2&f=ffffff&q=60,,"Place a net in the Neutral Zone or anywhere on the ice to use as a station.; Players perform  puckhandling techniques to work on quickness, agility and creativity.; Add a second player to work on heads up play or to act as a defender so players are working on offence and defence.",,[],Neutral Zone,Neutral Zone,[],['Stickhandling'],Intermediate
PUCK CONTROL - BOX CREATIVITY,https://cdn.hockeycanada.ca/hockey-canada/Hockey-Programs/Drill-Hub/Downloads/Drills/puck_control_box_creativity.jpg?w=640&h=360&c=2&f=ffffff&q=60,,Place 4 pylons in a box formation anywhere on the ice; Player skates in random pattern with puck around all 4 pylons; Finish with shot on net,"Fast feet, fast hands; Deception, fakes creativity",[],Unknown,Unknown,[],"['Skating', 'Stickhandling', 'Shooting']",Intermediate
PUCK CONTROL - CORNER OBSTACLE AGILITY,https://cdn.hockeycanada.ca/hockey-canada/Hockey-Programs/Drill-Hub/Downloads/Drills/puck_control_corner_obstacle_agility.jpg?w=640&h=360&c=2&f=ffffff&q=60,,"Players start in corner with pucks.; Place a couple of obstacles in the circle to act as a defensemen’s stick (Stick on pylon, Assistant coach, etc...); Players perform random moves working on moving the puck laterally and changing directions.  Quick feet and quick hands.",Let the players figure it out and be creative.,[],Offensive Zone,Offensive Zone,[],['Stickhandling'],Intermediate
PUCK CONTROL - ESCAPES,https://cdn.hockeycanada.ca/hockey-canada/Hockey-Programs/Drill-Hub/Downloads/Drills/puck_control_escapes.jpg?w=640&h=360&c=2&f=ffffff&q=60,,"Defensemen skate the drill backwards. When they come to a pylon, turn away from it in an escape move fashion; Shoot at the end of the drill",Maintain your speed; Bend your knees and keep good balance; Control the puck keeping the full blade on the ice; Turn your head and shoulder first into the escape turn,['Defence'],Unknown,Unknown,[],"['Skating', 'Shooting', 'Stickhandling']",Intermediate
PUCK CONTROL - LAND MINES,https://cdn.hockeycanada.ca/hockey-canada/Hockey-Programs/Drill-Hub/Downloads/Drills/puck_control_land_mines.jpg?w=640&h=360&c=2&f=ffffff&q=60,,Randomly spread out pucks within faceoff circle; Players perform puck control skills around and between pucks,Maintain control of the puck; Creativity with the puck; Quick feet and quick hands,[],Unknown,Unknown,['Small Area Game'],['Stickhandling'],Intermediate
PUCK CONTROL - NEUTRAL ZONE AGILITY,https://cdn.hockeycanada.ca/hockey-canada/Hockey-Programs/Drill-Hub/Downloads/Drills/puck_control_neutral_zone_agility.jpg?w=640&h=360&c=2&f=ffffff&q=60,,"Place pylons in a row in the Neutral Zone; Perform various puck skills as shown:; One hand to back hand; Eberle, pull back; Quick hands slow feet; Spin puck off stick; Puck first, feet follow; 1 crossover to forehand; 1 crossover each way","One hand to back hand; Eberle, pull back; Quick hands slow feet; Spin puck off stick; Puck first, feet follow; 1 crossover to forehand; 1 crossover each way",[],Neutral Zone,Neutral Zone,[],['Stickhandling'],Intermediate
PUCK CONTROL - PUCK CONTROL AGILITY WARM-UP,https://cdn.hockeycanada.ca/hockey-canada/Hockey-Programs/Drill-Hub/Downloads/Drills/puck_control_puck_control_agility_warm_up.jpg?w=640&h=360&c=2&f=ffffff&q=60,,"Players moves through the middle lane controlling the puck; Players perform the following skills; Side middle Side; Wide; Short, short, wide, wide; Forehand side control; Forehand side control shot fake; Mohawk backhand control; One hand forehand only; One hand backhand only; One hand backward skating; Crossover back and forth puck control; Single Crossover puck control; Puck between legs tight turn; Forehand side single knee drops; Forehand side backwards single knee drops","Side middle Side; Wide; Short, short, wide, wide; Forehand side control; Forehand side control shot fake; Mohawk backhand control; One hand forehand only; One hand backhand only; One hand backward skating; Crossover back and forth puck control; Single Crossover puck control; Puck between legs tight turn; Forehand side single knee drops; Forehand side backwards single knee drops",[],Unknown,Unknown,[],"['Skating', 'Stickhandling']",Intermediate
PUCK CONTROL - PUCK DOTS LINEAR,https://cdn.hockeycanada.ca/hockey-canada/Hockey-Programs/Drill-Hub/Downloads/Drills/puck_control_puck_dots_linear.jpg?w=640&h=360&c=2&f=ffffff&q=60,,Place a line of pucks in a straight line approximately 12 inches apart.; Player has to straddle the pucks with the skates and then move the puck from side to side in and out of the pucks.; Go forwards then backwards.  Add in toe drags to make it harder.,"Quiet feet, use range of motion of arms to so from side to side.; Exchange weight from skate to skate",[],Unknown,Unknown,[],"['Skating', 'Stickhandling']",Intermediate
PUCK CONTROL - PUCK DOTS WIDE,https://cdn.hockeycanada.ca/hockey-canada/Hockey-Programs/Drill-Hub/Downloads/Drills/puck_control_puck_dots_wide.jpg?w=640&h=360&c=2&f=ffffff&q=60,,"Start with two lines of 5 or 6 pucks about 4 – 5 feet apart.; Move the puck from side to side, keeping both hands on the stick.; Keep the feet wide for greater range of motion.; For a progression, stickhandle at each puck before moving it to the other side",Feet wide and make sure the bottom hand can slide on the shaft for greater quickness and range of motion,[],Unknown,Unknown,[],['Stickhandling'],Intermediate
PUCK CONTROL - AGILITY AND RANGE OF MOTION,https://cdn.hockeycanada.ca/hockey-canada/Hockey-Programs/Drill-Hub/Downloads/Drills/puck_control_agility_and_range_of_motion.jpg?w=640&h=360&c=2&f=ffffff&q=60,,"Place sticks on ice to act as obstacles; One vertical, one horizontal; Quick hands, range of motion, toe drags, flip over stick","Quick Hands, smooth movements; Range of motion",[],Unknown,Unknown,[],['Stickhandling'],Intermediate
PUCK CONTROL - FIGURE 8,https://cdn.hockeycanada.ca/hockey-canada/Hockey-Programs/Drill-Hub/Downloads/Drills/puck_control_figure_8.jpg?w=640&h=360&c=2&f=ffffff&q=60,,Place two pucks about 10 feet apart; Player skates in a figure 8 pattern around the pucks,"As the puck comes around the pylon, try to move is as quickly as possible from forehand to backhand and backhand to forehand; Move the puck as far as possible from forehand to backhand and backhand to forehand",[],Unknown,Unknown,[],['Stickhandling'],Easy
PUCK CONTROL - PUCK DOTS ZIG ZAG,https://cdn.hockeycanada.ca/hockey-canada/Hockey-Programs/Drill-Hub/Downloads/Drills/puck_control_puck_dots_zig_zag.jpg?w=640&h=360&c=2&f=ffffff&q=60,,"Place pucks in a zig zag pattern; Perform various puck handling skills as shown:Side to side, take bottom hand off stick on forehandMove puck quickly for forehand to backhand and vice versaOne Crossover coming around puck; Side to side, take bottom hand off stick on forehand; Move puck quickly for forehand to backhand and vice versa; One Crossover coming around puck","Side to side, take bottom hand off stick on forehand; Move puck quickly for forehand to backhand and vice versa; One Crossover coming around puck",[],Unknown,Unknown,[],['Stickhandling'],Intermediate
PUCK CONTROL – WARM UP 5,https://cdn.hockeycanada.ca/hockey-canada/Hockey-Programs/Drill-Hub/Downloads/Drills/puck_control_warm_up_5.jpg?w=640&h=360&c=2&f=ffffff&q=60,,"Have the players skate along the lines of the ice ie blue line,
    red line, blue line and use ringette lines too for more reps.; Perform various puck handling skills as show using the line
    as a guide","Repetition is key so do the same skill on all the lines for
    more repetition; Utilize skills that emphasize range of motion using the line
    as a guide for doing the moves.",[],All Zones,All Zones,[],"['Skating', 'Stickhandling']",Intermediate
PUCK CONTROL – 3 PUCK – QUICK HANDS,https://cdn.hockeycanada.ca/hockey-canada/Hockey-Programs/Drill-Hub/Downloads/Drills/puck_control_3_puck_quick_hands.jpg?w=640&h=360&c=2&f=ffffff&q=60,,"Two players skate into circle handling 1 puck in a random
    pattern; On whistle, each player gets passed a second puck – handle
    both at same time; On next whistle, each player gets passed a third puck –
    handle all 3 at same time","Quick hands, dynamic moves; Change pucks as quickly as possible",[],Unknown,Unknown,[],['Stickhandling'],Intermediate
PUCK CONTROL – STATIONARY STICKHANDLE,https://cdn.hockeycanada.ca/hockey-canada/Hockey-Programs/Drill-Hub/Downloads/Drills/puck_control_3_puck_stationary_stickhandle.jpg?w=640&h=360&c=2&f=ffffff&q=60,,Place 3 pucks in front of the player; Player handles all 3 pucks alternating touching each one,Quick hands; Hand eye coordination; Move pucks in random pattern,[],Unknown,Unknown,[],['Stickhandling'],Easy
PUCK CONTROL – ATTACK THE TRIANGLE #1 – STATIONARY,https://cdn.hockeycanada.ca/hockey-canada/Hockey-Programs/Drill-Hub/Downloads/Drills/puck_control_attack_the_triangle_1.jpg?w=640&h=360&c=2&f=ffffff&q=60,,"Place one player stationary on a dot with feet apart and
    stick out in front; Second player stickhandles puck in and out of the skates and
    stick (the triangle); Progression – stationary player can move stick to make it
    more difficult","Think one move ahead; Quick hands, change weight from one leg to the other; Pull stick inside of defenders stick instead of going over top
    all the time",[],Unknown,Unknown,[],['Stickhandling'],Easy
PUCK CONTROL – ATTACK THE TRIANGLE #2,https://cdn.hockeycanada.ca/hockey-canada/Hockey-Programs/Drill-Hub/Downloads/Drills/puck_control_attack_the_triangle_2.jpg?w=640&h=360&c=2&f=ffffff&q=60,,"Place one player stationary on a dot with feet apart and
    stick out in front; Second player stickhandles puck in and out of the skates and
    stick (the triangle); Puckhandling player can skate in any direction and all
    around the stationary player","Think one move ahead; Quick hands, change weight from one leg to the other; Pull stick inside of defenders stick instead of going over top
    all the time",['Forward'],Unknown,Unknown,[],['Stickhandling'],Intermediate
PUCK CONTROL – ATTACK THE TRIANGLE #3,https://cdn.hockeycanada.ca/hockey-canada/Hockey-Programs/Drill-Hub/Downloads/Drills/puck_control_attack_the_triangle_3.jpg?w=640&h=360&c=2&f=ffffff&q=60,,"Place one player stationary on a dot with feet apart and
    stick out in front; Second player stickhandles puck in and out of the skates and
    stick (the triangle); Quick attack moves, in and out then pass to next player in
    line; Rotate players","Think one move ahead; Quick hands, change weight from one leg to the other; Pull stick inside of defenders stick instead of going over top
    all the time",[],Unknown,Unknown,[],['Stickhandling'],Intermediate
PUCK CONTROL – STICKHANDLE AND SHOOT,https://cdn.hockeycanada.ca/hockey-canada/Hockey-Programs/Drill-Hub/Downloads/Drills/puck_control_stickhandle_and_shoot.jpg?w=640&h=360&c=2&f=ffffff&q=60,,"Player starts in circle with 1 puck; Stickhandle in random pattern, on whistle – shoot; Coach then adds 2 pucks, stickhandle both and shoot both; Coach then adds 3 pucks, stickhandle all 3 and shoot all
    three","Quick hands; Shoot to score; When using 2 or 3 pucks, place them in position to shoot
    quickly",[],Unknown,Unknown,[],"['Stickhandling', 'Shooting']",Intermediate
